{
  "kind": "measured",
  "benchmark": "mlperf-tiny-ic-resnet8-cifar10-int8",
  "stage": "hw_accuracy",
  "timestamp_utc": "2026-08-29T02:17:24Z",
  "producer_script": "scripts/run_jtag_benchmark.py",
  "run_host": "tcovert + Ti180 J484 Dev Kit (JTAG data, COM6 ctrl)",
  "config": {
    "device": "Ti180J484C4",
    "board": "Efinix Titanium Ti180 J484 Development Kit",
    "tool_versions": {
      "efinity": "2026.1.132.3.9",
      "riscv_gcc": "xPack riscv-none-elf-gcc 15.2.0-1",
      "efinix_tinyml_repo": "96886fa (github.com/Efinix-Inc/tinyml)",
      "tflite_micro": "vendored in Efinix tinyml repo"
    },
    "clk_core_mhz": 250.0,
    "accel_config": "tinyml_core0_define.v resnet8-only: conv 16x8 STANDARD, ADD STANDARD, RS STANDARD, FC/MUL/LR/MIN_MAX DISABLE (FC in software), FIFOs 64/36, cache 4096, AXI_DW=512",
    "bitstream_sha256": "1d91d5ff7b864d8ac75aa81bff8bd01605468031b342022f3652103e50feec6d",
    "batch_size": 1,
    "dataset": "cifar10-test-1000",
    "clint_hz": 100000000,
    "input_quant": {
      "scale": 1.0,
      "zero_point": -128
    },
    "data_transport": "JTAG bulk load to DDR (untimed); UART control only"
  },
  "metrics": {
    "top1_pct": 88.0,
    "n_records": 1000,
    "n_correct": 880,
    "agreement_vs_agilex_cpu_int8": 956
  },
  "notes": "CIFAR-10 test indices 0..n-1. Images quantized on host, bulk-loaded over JTAG, executed back-to-back from DDR."
}